<!ELEMENT UWSimScene (oceanState?,simParams?,camera?,vehicle*,object*,rosInterfaces?)>

<!-- elementos oceanScene -->
<!ELEMENT oceanState (windx?,windy?,windSpeed?,depth?,reflectionDamping?,waveScale?,isNotChoppy?,choppyFactor?,crestFoamHeight?,oceanSurfaceHeight?,fog?,color?,attenuation?)>
<!ELEMENT simParams (disableShaders?,resw?,resh?,offsetp?,offsetr?,enablePhysics?,gravity?,physicsWater?,physicsFrequency?)>
<!ELEMENT vehicle (name,file,jointValues?,position?,orientation?,virtualCamera*, structuredLightProjector*, rangeSensor*, objectPicker*, imu*, pressureSensor*, gpsSensor*, dvlSensor*, virtualRangeImage*,multibeamSensor*, simulatedDevices?, 
echo*
,vehiclePhysics*
,vehicleMass*
,vehicleForce*
,vehicleBuoyance*
,vehicleDrag*
,vehicleThruster*
,flipper*
,directionalReceiver*
,beaconReceiver*
,skeletonFin*
,passiveFin*
,gameCamera?
,game2D?
 )>
<!ELEMENT virtualCamera (name,relativeTo,resw?,resh?,position?,orientation?,baseline?,frameId?, parameters?, showpath?)>
<!ELEMENT virtualRangeImage (name,relativeTo,resw?,resh?,position?,orientation?,parameters?)>
<!ELEMENT rangeSensor (name,relativeTo,range,visible?,position?,orientation?)>
<!ELEMENT objectPicker (name,relativeTo,range,position?,orientation?)>
<!ELEMENT imu (name,relativeTo,position?,orientation?, std?)>
<!ELEMENT pressureSensor (name,relativeTo,position?,orientation?, std?)>
<!ELEMENT gpsSensor (name,relativeTo,position?,orientation?, std?)>
<!ELEMENT dvlSensor (name,relativeTo,position?,orientation?, std?)>
<!ELEMENT multibeamSensor (name,relativeTo,position?,orientation?, initAngle,finalAngle, angleIncr,range)>
<!ELEMENT camera (freeMotion?,objectToTrack?,fov?,aspectRatio?,near?,far?,position?,lookAt?) >
<!ELEMENT object (name,file,position,orientation,offsetp?,offsetr?,physics?)>
<!ELEMENT rosInterfaces ((ROSOdomToPAT*)?, (PATToROSOdom*)?, (WorldToROSTF*)?, (ArmToROSJointState*)?, (ROSJointStateToArm*)?, (VirtualCameraToROSImage*)?, (ROSImageToHUD*)?,(ROSTwistToPAT*)?, (RangeSensorToROSRange*)?, (ROSPoseToPAT*)?, (ImuToROSImu*)?, (PressureSensorToROS*)?, (GPSSensorToROS*)?, (DVLSensorToROS*)?, (RangeImageSensorToROSImage*)?,(multibeamSensorToLaserScan*)?
, (SimulatedDeviceROS*)?
, skeletonFinROS*
, gameCameraROS*
, flipperROS?
, depth2SonarROS*
, fluidPressureROS*
, beaconReceiverROS*
, vehicleBuoyanceROS*
, vehicleForceROS*
)>

<!ELEMENT structuredLightProjector (name,relativeTo,fov,image_name,visible?,position?,orientation?)>

<!-- elementos comunes -->
<!ELEMENT position (x,y,z)>
<!ELEMENT orientation (r,p,y)>
<!ELEMENT offsetp (x,y,z)>
<!ELEMENT offsetr (x,y,z)>
<!ELEMENT lookAt (x,y,z)>
<!ELEMENT color (r,g,b)>

<!ELEMENT x (#PCDATA)>
<!ELEMENT y (#PCDATA)>
<!ELEMENT z (#PCDATA)>
<!ELEMENT r (#PCDATA)>
<!ELEMENT g (#PCDATA)>
<!ELEMENT b (#PCDATA)>
<!ELEMENT p (#PCDATA)>
<!ELEMENT std (#PCDATA)>


<!-- elementos oceanState -->
<!ELEMENT windx (#PCDATA)>
<!ELEMENT windy (#PCDATA)>
<!ELEMENT windSpeed (#PCDATA)>
<!ELEMENT depth (#PCDATA)>
<!ELEMENT reflectionDamping (#PCDATA)>
<!ELEMENT waveScale (#PCDATA)>
<!ELEMENT isNotChoppy (#PCDATA)>
<!ELEMENT choppyFactor (#PCDATA)>
<!ELEMENT crestFoamHeight (#PCDATA)>
<!ELEMENT oceanSurfaceHeight (#PCDATA)>
<!ELEMENT fog (density,color)>
<!ELEMENT attenuation (r,g,b)>

<!ELEMENT density (#PCDATA)>

<!-- elementos simParams -->
<!ELEMENT disableShaders (#PCDATA)>
<!ELEMENT eye_in_hand (#PCDATA)>
<!ELEMENT resw (#PCDATA)>
<!ELEMENT resh (#PCDATA)>
<!ELEMENT enablePhysics (#PCDATA)>
<!ELEMENT gravity (x,y,z)>
<!ELEMENT physicsWater (size,position,resolution)>
<!ELEMENT size (minX,maxX,minY,maxY,minZ,maxZ)>
<!ELEMENT resolution (#PCDATA)>
<!ELEMENT minX (#PCDATA)>
<!ELEMENT maxX (#PCDATA)>
<!ELEMENT minY (#PCDATA)>
<!ELEMENT maxY (#PCDATA)>
<!ELEMENT minZ (#PCDATA)>
<!ELEMENT maxZ (#PCDATA)>
<!ELEMENT physicsFrequency (#PCDATA)>


<!--elementos camera -->
<!ELEMENT freeMotion (#PCDATA)>
<!ELEMENT fov (#PCDATA)>
<!ELEMENT aspectRatio (#PCDATA)>
<!ELEMENT near (#PCDATA)>
<!ELEMENT far (#PCDATA)>

<!ELEMENT objectToTrack (#PCDATA)>

<!-- elementos virtualCamera -->
<!ELEMENT relativeTo (#PCDATA)>
<!ELEMENT parameters (fx,fy,x0,y0,f,n,k)>

<!ELEMENT fx (#PCDATA)>
<!ELEMENT fy (#PCDATA)>
<!ELEMENT x0 (#PCDATA)>
<!ELEMENT y0 (#PCDATA)>
<!ELEMENT f (#PCDATA)>
<!ELEMENT n (#PCDATA)>
<!ELEMENT k (#PCDATA)>
<!ELEMENT baseline (#PCDATA)>
<!ELEMENT frameId (#PCDATA)>
<!ELEMENT showpath (#PCDATA)>

<!--elementos rangeSensor -->
<!ELEMENT range (#PCDATA)>
<!ELEMENT visible (#PCDATA)>

<!--elementos structuredLightProjector -->
<!ELEMENT image_name (#PCDATA)>

<!--elementos multibeamSensor -->
<!ELEMENT initAngle (#PCDATA)>
<!ELEMENT finalAngle (#PCDATA)>
<!ELEMENT angleIncr (#PCDATA)>

<!-- elementos vehicle -->
<!ELEMENT name (#PCDATA)>
<!ELEMENT file (#PCDATA)>
<!ELEMENT jointValues (joint+)>

<!ELEMENT joint (#PCDATA)>

<!-- elementos rosinterfaces -->
<!ELEMENT ROSOdomToPAT (topic,vehicleName, visualize?)>
<!ELEMENT PATToROSOdom  (topic, vehicleName, rate?, frameId?)>
<!ELEMENT WorldToROSTF  (rootName, enableObjects?, rate?)>
<!ELEMENT ArmToROSJointState  (topic, vehicleName, rate?)>
<!ELEMENT ROSJointStateToArm  (topic,vehicleName)>
<!ELEMENT VirtualCameraToROSImage (cameraName,imageTopic,infoTopic,rate?,depth?)>
<!ELEMENT RangeImageSensorToROSImage (cameraName,imageTopic,infoTopic,rate?)>
<!ELEMENT RangeSensorToROSRange (name,topic,rate?)>
<!ELEMENT ROSImageToHUD (width,height,posx?,posy?,scale?,blackWhite?,imageTopic,infoTopic?)>
<!ELEMENT ROSTwistToPAT (topic,vehicleName)>
<!ELEMENT ROSPoseToPAT (topic,vehicleName)>
<!ELEMENT ImuToROSImu (name, topic, rate?)>
<!ELEMENT PressureSensorToROS (name, topic, rate?)>
<!ELEMENT GPSSensorToROS (name, topic, rate?)>
<!ELEMENT DVLSensorToROS (name, topic, rate?)>
<!ELEMENT multibeamSensorToLaserScan (name, topic, rate?)>

<!ELEMENT width (#PCDATA)>
<!ELEMENT height (#PCDATA)>
<!ELEMENT posx (#PCDATA)>
<!ELEMENT posy (#PCDATA)>
<!ELEMENT blackWhite (#PCDATA)>
<!ELEMENT scale (#PCDATA)>
<!ELEMENT topic (#PCDATA)>
<!ELEMENT vehicleName (#PCDATA)>
<!ELEMENT rate (#PCDATA)>
<!ELEMENT cameraName (#PCDATA)>
<!ELEMENT imageTopic (#PCDATA)>
<!ELEMENT infoTopic (#PCDATA)>
<!ELEMENT visualize (#PCDATA)>
<!ELEMENT rootName (#PCDATA)>
<!ELEMENT enableObjects (#PCDATA)>

<!-- elementos vcamtoROSImage -->
<!ELEMENT cam (#PCDATA)>
<!ELEMENT info (#PCDATA)>

<!-- elementos physics -->
<!ELEMENT physics (mass?,inertia?,collisionShapeType?,linearDamping?,angularDamping?,isKinematic? , minLinearLimit?, maxLinearLimit?,minAngularLimit?,maxAngularLimit?)>
<!ELEMENT mass (#PCDATA)>
<!ELEMENT inertia (x,y,z)>
<!ELEMENT collisionShapeType (#PCDATA)>
<!ELEMENT linearDamping (#PCDATA)>
<!ELEMENT angularDamping (#PCDATA)>
<!ELEMENT minLinearLimit (x,y,z)>
<!ELEMENT maxLinearLimit (x,y,z)>
<!ELEMENT isKinematic (#PCDATA)>
<!ELEMENT minAngularLimit (x,y,z)>
<!ELEMENT maxAngularLimit (x,y,z)>
<!ELEMENT forceType (#PCDATA)>

<!ELEMENT echo (name, info )>
<!ELEMENT echoROS (name, topic, rate?)>

<!-- vehiclePhysics -->
<!ELEMENT vehiclePhysics (name, linkName, physics, debugForceRatio?)>
<!ELEMENT maxForce (#PCDATA)>
<!ELEMENT maxTorque (#PCDATA)>
<!ELEMENT vehicleMass (name, relativeTo, mass+, position*, debugForceRatio?, color?)>
<!ELEMENT vehicleDrag (name, relativeTo, radius, tranDrag, maxForce?, maxTorque?, tranLift?, rotDrag?, position?, isROS?, debugForceRatio?, color?)>
<!ELEMENT vehicleBuoyance (name, relativeTo, radius+, mass+, position*, isROS?, debugForceRatio?, color?)>
<!ELEMENT vehicleThruster (name, relativeTo, radius+, position*, orientation*, defaultForce*, isROS?, debugForceRatio?, color?)>
<!ELEMENT vehicleForce (name, relativeTo, forceType, position, isROS?)>

<!ELEMENT tranDrag (x,y,z)>
<!ELEMENT rotDrag (r,p,y)>
<!ELEMENT tranLift (x,y,z)>
<!ELEMENT defaultForce (x,y,z)>
<!ELEMENT debugForceRatio (#PCDATA)>
<!ELEMENT linkName (#PCDATA)>
<!ELEMENT radius (#PCDATA)>
<!ELEMENT isROS (#PCDATA)>

<!ELEMENT vehicleThrusterROS (vehicleName, topic, infoTopic?, rate?)>
<!ELEMENT vehicleBuoyanceROS (vehicleName, topic, infoTopic?, rate?)>
<!ELEMENT vehicleDragROS (vehicleName, topic, infoTopic?, rate?)>
<!ELEMENT vehicleMassROS (vehicleName, topic, infoTopic?, rate?)>

<!ELEMENT angle (#PCDATA)>
<!ELEMENT sensitiveTo (#PCDATA)>
<!ELEMENT numberOfLines (#PCDATA)>
<!ELEMENT directionalReceiver (name, relativeTo, sensitiveTo*, range, angle, numberOfLines?, visible?, position?, orientation?)>
<!ELEMENT directionalReceiverROS (name, topic, rate?)>

<!ELEMENT requiresLineOfSight (#PCDATA)>
<!ELEMENT notBlockedBy (#PCDATA)>
<!ELEMENT measurementStd (#PCDATA)>
<!ELEMENT beaconPosStd (#PCDATA)>
<!ELEMENT beaconReceiver (name, relativeTo, sensitiveTo*, requiresLineOfSight?, notBlockedBy*, range, visible?, position?, orientation?, measurementStd?, beaconPosStd?)>
<!ELEMENT beaconReceiverROS (name, topic, rate?)>

<!ELEMENT skeletonFinROS (vehicleName, topic)>
<!ELEMENT jointName (#PCDATA)>
<!ELEMENT side (#PCDATA)>
<!ELEMENT forceAngle (#PCDATA)>
<!ELEMENT forceMultiplier (#PCDATA)>
<!ELEMENT multPower (#PCDATA)>
<!ELEMENT borderBack (#PCDATA)>
<!ELEMENT skeletonFin (name, relativeTo, side, radius, jointName*, position?, orientation?, debugForceRatio?, color?, forceMultiplier?, maxForce?, multPower?, borderBack?, forceAngle?)>

<!ELEMENT maxSpeed (#PCDATA)>
<!ELEMENT divisor (#PCDATA)>
<!ELEMENT publishAll (#PCDATA)>
<!ELEMENT passiveFin (name, relativeTo, side, radius, jointName*, position?, orientation?, maxSpeed?, divisor?)>

<!ELEMENT distance (#PCDATA)>
<!ELEMENT trackMode (#PCDATA)>
<!ELEMENT gameCamera (name, distance, trackMode, orientation, l*)>

<!ELEMENT type (#PCDATA)>
<!ELEMENT gameCameraROS (name, type, topic)>

<!ELEMENT game2D (name, relativeTo, radius, distance, distanceDivisor, entrance*)>
<!ELEMENT distanceDivisor (#PCDATA)>
<!ELEMENT entrance (x,y,z)>

<!ELEMENT flipperROS (vehicleName, topic)>

<!ELEMENT l (k,en,et?,ru?)>
<!ELEMENT en (#PCDATA)>
<!ELEMENT et (#PCDATA)>
<!ELEMENT ru (#PCDATA)>

<!ELEMENT flipper (name, relativeTo, radius, jointName*, position?, orientation?, debugForceRatio?, color?, forceMultiplier?, maxForce?, multPower?, forceAngle?)>

<!ELEMENT depth2SonarROS (name, topic, frameId, divisor, publishAll?, infoTopic?, rate?)>
<!ELEMENT fluidPressureROS (name, topic, frameId, rate?)>

<!ELEMENT vehicleForceROS (name, topic)>
